doi,title,year,is_paywalled,oa_status,primary_source
10.1101/2025.10.29.684686,Connectivity biases generate a learning hierarchy in the <i>Drosophila</i> mushroom body,2025,False,preprint,biorxiv
10.1101/2025.06.02.657513,Retinal Calcium Waves Coordinate Uniform Tissue Patterning of the <i>Drosophila</i> Eye,2025,False,preprint,biorxiv
10.1101/2022.05.28.492955,Female reproductive dormancy in <i>Drosophila melanogaster</i> is regulated by DH31-producing neurons projecting into the <i>corpus allatum</i>,2022,False,preprint,biorxiv
10.2139/ssrn.3948201,Oxygen Plasma Focused Ion Beam: Optimised Beam Chemistry to Improve the Throughput of FIB/SEM Tomography on Biological Samples,2021,,,
10.1101/2024.10.24.620060,Continuous integration of heading and goal directions guides steering,2024,False,preprint,biorxiv
10.1145/3712255.3734341,Self-Organizing Models of Brain Wiring: Developmental Programs for Evolving Intelligence,2025,,,
10.1038/s41586-026-10306-z,Aversive learning hijacks a brain sugar sensor to consolidate memory,2026,,,
10.64898/2026.02.27.708413,A GPI-anchored Ly6/uPAR superfamily gene <i>belly roll</i> is expressed in multiple peptidergic neurons in <i>Drosophila melanogaster</i> larvae,2026,,,
10.1111/acps.12387,Distinct intrinsic network connectivity patterns of post‐traumatic stress disorder symptom clusters,2015,,,
10.1038/nmeth.2695,Neuroscience waves to the crowd,2013,,,
10.1038/s41586-021-03992-4,An open-access volume electron microscopy atlas of whole cells and tissues,2021,,,
10.1016/j.neuroimage.2004.07.019,A framework to study the cortical folding patterns,2004,,,
10.1038/srep22834,Recovery of Interdependent Networks,2016,,,
10.1038/srep02223,Discovery of a kernel for controlling biomolecular regulatory networks,2013,,,
10.1109/tnse.2022.3196786,A Recent Survey on Control for Synchronization and Passivity of Complex Networks,2022,,,
10.7554/elife.59928,Common cell type nomenclature for the mammalian brain,2020,,,
10.1109/tcbb.2018.2797271,Structural Target Controllability of Linear Networks,2018,,,
10.1210/endrev/bnad001,Recent Advances in the Role of Autophagy in Endocrine-Dependent Tumors,2023,,,
10.1038/srep04547,Revealing the Hidden Language of Complex Networks,2014,,,
10.1056/nejmoa043331,<i>MGMT</i> Gene Silencing and Benefit from Temozolomide in Glioblastoma,2005,,,
10.1038/s41467-022-34693-9,Extending resolution within a single imaging frame,2022,,,
10.7554/elife.58942,Cell types and neuronal circuitry underlying female aggression in Drosophila,2020,,,
10.3390/cells12091322,Role of Macroautophagy in Mammalian Male Reproductive Physiology,2023,,,
10.3389/fncir.2013.00151,Three-dimensional mapping of microcircuit correlation structure,2013,,,
10.1371/journal.pgen.1010029,Redundant neural circuits regulate olfactory integration,2022,,,
10.1038/s41467-024-45751-9,A spatial map of hepatic mitochondria uncovers functional heterogeneity shaped by nutrient-sensing signaling,2024,,,
10.1038/s41467-023-39804-8,Inheritance of associative memories and acquired cellular changes in C. elegans,2023,,,
10.1016/j.neuroimage.2011.09.015,FSL,2011,,,
10.1073/pnas.2406565121,A hyperpolarizing neuron recruits undocked innexin hemichannels to transmit neural information in <i>Caenorhabditis elegans</i>,2024,,,
10.7554/elife.106686,Cell-specific tools for understanding behavior,2025,,,
10.1038/nature13240,Space–time wiring specificity supports direction selectivity in the retina,2014,,,
10.1002/2017jb014698,Surface Wave Tomography of the Alps Using Ambient‐Noise and Earthquake Phase Velocity Measurements,2018,,,
10.1103/physreve.94.032301,Message passing theory for percolation models on multiplex networks with link overlap,2016,,,
10.1038/s41586-021-03977-3,Whole-cell organelle segmentation in volume electron microscopy,2021,,,
10.1016/j.biopsych.2020.06.031,Four Deep Brain Stimulation Targets for Obsessive-Compulsive Disorder: Are They Different?,2020,,,
10.1016/j.laa.2015.06.025,"Zero forcing number, constrained matchings and strong structural controllability",2015,,,
10.3389/fncir.2013.00153,A method for the three-dimensional reconstruction of Neurobiotin™-filled neurons and the location of their synaptic inputs,2013,,,
10.1093/oxfordjournals.eurheartj.a014868,"Heart rate variability: Standards of measurement, physiological interpretation, and clinical use",1996,,,
10.1038/s41576-022-00562-w,Autophagy genes in biology and disease,2023,,,
10.1016/s0896-6273(02)00569-x,Whole Brain Segmentation,2002,,,
10.1016/j.tics.2020.01.008,Linking Structure and Function in Macroscale Brain Networks,2020,,,
10.1093/nar/gkac1062,EMPIAR: the Electron Microscopy Public Image Archive,2022,,,
10.7554/elife.18659,A novel optical microscope for imaging large embryos and tissue volumes with sub-cellular resolution throughout,2016,,,
10.1194/jlr.d048660,Spatiotemporal lipid profiling during early embryo development of Xenopus laevis using dynamic ToF-SIMS imaging,2014,,,
10.3389/fphys.2021.719038,Behavior Individuality: A Focus on Drosophila melanogaster,2021,,,
10.1111/gbi.12088,3‐D analysis of bacterial cell‐(iron)mineral aggregates formed during Fe(<scp>II</scp>) oxidation by the nitrate‐reducing <i>Acidovorax sp</i>. strain BoFeN1 using complementary microscopy tomography approaches,2014,,,
10.1016/j.conb.2020.08.013,"Brain-wide, scale-wide physiology underlying behavioral flexibility in zebrafish",2020,,,
10.1038/s41467-021-21246-9,Inference and analysis of cell-cell communication using CellChat,2021,,,
10.1016/j.cub.2022.08.030,Regional cytoarchitecture of the adult and developing mouse enteric nervous system,2022,,,
10.3389/fncir.2011.00001,Characterization of Genetically Targeted Neuron Types in the Zebrafish Optic Tectum,2011,,,
10.7554/elife.28975,Nuclear microenvironments modulate transcription from low-affinity enhancers,2017,,,
10.1080/00207179.2012.690162,Controllability analysis of multi-agent systems with directed and weighted interconnection,2012,,,
10.1186/1475-925x-12-59,Hierarchical level features based trainable segmentation for electron microscopy images,2013,,,
10.3389/fbinf.2023.1233748,Moving beyond the desktop: prospects for practical bioimage analysis via the web,2023,,,
10.1038/nmeth.3833,Expansion microscopy with conventional antibodies and fluorescent proteins,2016,,,
10.1523/jneurosci.1616-12.2012,Subcellular Synaptic Connectivity of Layer 2 Pyramidal Neurons in the Medial Prefrontal Cortex,2012,,,
,"SEER Cancer Statistics Review, 1975-2003",2006,,,
10.1109/tac.2013.2250075,"Zero Forcing, Linear and Quantum Controllability for Systems Evolving on Networks",2013,,,
10.1523/jneurosci.4179-07.2007,Nanoscale Organization of the MEC-4 DEG/ENaC Sensory Mechanotransduction Channel in<i>Caenorhabditis elegans</i>Touch Receptor Neurons,2007,,,
10.1002/hbm.10062,Fast robust automated brain extraction,2002,,,
10.1016/j.jneumeth.2010.11.015,eConnectome: A MATLAB toolbox for mapping and imaging of brain functional connectivity,2010,,,
10.1016/j.neuron.2016.06.012,"NBLAST: Rapid, Sensitive Comparison of Neuronal Structure and Construction of Neuron Family Databases",2016,,,
10.4230/lipics.giscience.2023.43,"Aion Framework: Dimensional Emergence of AI Consciousness, Observer-Induced Collapse, and Cosmological Portal Dynamics",2023,,,
10.1038/s41592-023-02059-8,Multi-layered maps of neuropil with segmentation-guided contrastive learning,2023,,,
10.1093/eurheartj/eht151,2013 ESH/ESC Guidelines for the management of arterial hypertension,2013,,,
10.1523/jneurosci.06-08-02252.1986,Morphological transformation of synaptic terminals of a phasic motoneuron by long-term tonic stimulation,1986,,,
10.7554/elife.46249,Expansion microscopy of C. elegans,2020,,,
10.3389/fncel.2020.581907,"Amyotrophic Lateral Sclerosis: Proteins, Proteostasis, Prions, and Promises",2020,,,
10.1186/1471-2105-13-s8-s7,NetMets: software for quantifying and visualizing errors in biological network segmentation,2012,,,
10.1093/gigascience/giae049,CAT: a computational anatomy toolbox for the analysis of structural MRI data,2024,,,
10.1016/j.canlet.2024.216860,Nanomaterials in crossroad of autophagy control in human cancers: Amplification of cell death mechanisms,2024,,,
10.1038/44565,Learning the parts of objects by non-negative matrix factorization,1999,,,
10.1016/j.biopha.2024.117367,Overview of pyroptosis mechanism and in-depth analysis of cardiomyocyte pyroptosis mediated by NF-κB pathway in heart failure,2024,,,
10.1002/glia.24362,Astrocyte structural heterogeneity in the mouse hippocampus,2023,,,
10.3390/v7112900,3D Analysis of HCMV Induced-Nuclear Membrane Structures by FIB/SEM Tomography: Insight into an Unprecedented Membrane Morphology,2015,,,
10.1038/s41598-019-46657-z,LC3-positive structures are prominent in autophagy-deficient cells,2019,,,
10.1016/j.cub.2020.05.077,Input Connectivity Reveals Additional Heterogeneity of Dopaminergic Reinforcement in Drosophila,2020,,,
10.1038/s41467-020-14518-3,A molecular gradient along the longitudinal axis of the human hippocampus informs large-scale behavioral systems,2020,,,
10.1016/s0140-6736(17)32154-2,"Global, regional, and national incidence, prevalence, and years lived with disability for 328 diseases and injuries for 195 countries, 1990–2016: a systematic analysis for the Global Burden of Disease Study 2016",2017,,,
10.1016/j.automatica.2013.07.021,Input addition and leader selection for the controllability of graph-based systems,2013,,,
10.1016/j.neuroimage.2012.03.070,Dynamic connectivity regression: Determining state-related changes in brain connectivity,2012,,,
10.1523/jneurosci.4500-08.2009,Correlated Connectivity and the Distribution of Firing Rates in the Neocortex,2009,,,
10.1109/tac.2012.2208314,A Class of Uncontrollable Diffusively Coupled Multiagent Systems with Multichain Topologies,2012,,,
10.1073/pnas.0905267106,Correspondence of the brain's functional architecture during activation and rest,2009,,,
10.1109/jbhi.2015.2450362,Big Data for Health,2015,,,
10.3389/fninf.2014.00079,LEMS: a language for expressing complex biological models in concise and hierarchical form and its use in underpinning NeuroML 2,2014,,,
10.1093/cercor/bhs290,A Hierarchical Structure of Cortical Interneuron Electrical Diversity Revealed by Automated Statistical Analysis,2012,,,
10.1002/cne.23102,Age‐related plasticity in the synaptic ultrastructure of neurons in the mushroom body calyx of the adult honeybee <i>Apis mellifera</i>,2012,,,
10.1002/1531-8249(199902)45:2<265::aid-ana21>3.0.co;2-3,Three-dimensional tracking of axonal projections in the brain by magnetic resonance imaging,1999,,,
10.1109/tro.2018.2857475,A Survey on Aerial Swarm Robotics,2018,,,
10.1038/s41586-023-06956-y,Motion of VAPB molecules reveals ER–mitochondria contact site subdomains,2024,,,
10.1038/s41418-019-0474-7,Autophagy in cancer: moving from understanding mechanism to improving therapy responses in patients,2019,,,
10.1038/nature12107,Structural and molecular interrogation of intact biological systems,2013,,,
10.1002/cne.24932,The connectome of the <scp> <i>Caenorhabditis elegans</i> </scp> pharynx,2020,,,
10.1002/(sici)1097-0193(1999)8:4<272::aid-hbm10>3.0.co;2-4,High-resolution intersubject averaging and a coordinate system for the cortical surface,1999,,,
10.1038/s41592-022-01621-0,Automated synapse-level reconstruction of neural circuits in the larval zebrafish brain,2022,,,
10.1038/s41467-024-48272-7,Spatial mapping of hepatic ER and mitochondria architecture reveals zonated remodeling in fasting and obesity,2024,,,
10.1016/j.cell.2006.06.044,Matrix Elasticity Directs Stem Cell Lineage Specification,2006,,,
10.31219/osf.io/d439p,Uruguayan Insect Research: Seven Decades Shaping Neuroscience,2024,,,
10.1016/j.jseaes.2010.11.011,"Surface deformation related to the 2008 Wenchuan earthquake, and mountain building of the Longmen Shan, eastern Tibetan Plateau",2010,,,
10.1016/j.carbon.2007.02.034,Synthesis of graphene-based nanosheets via chemical reduction of exfoliated graphite oxide,2007,,,
10.1016/j.eswa.2020.113681,A systematic survey on influential spreaders identification in complex networks with a focus on K-shell based techniques,2020,,,
10.1093/nsr/nwt032,Challenges of Big Data analysis,2014,,,
10.1242/jcs.190967,Deep nuclear invaginations linked to cytoskeletal filaments: Integrated bioimaging of epithelial cells in 3D culture,2016,,,
10.1038/381607a0,Emergence of simple-cell receptive field properties by learning a sparse code for natural images,1996,,,
10.3390/cells9051321,Progress and Challenges in the Use of MAP1LC3 as a Legitimate Marker for Measuring Dynamic Autophagy In Vivo,2020,,,
10.1016/j.mam.2021.100966,Moments in autophagy and disease: Past and present,2021,,,
10.1097/00004647-200110000-00001,An Energy Budget for Signaling in the Grey Matter of the Brain,2001,,,
10.15252/embj.2021108863,Autophagy in major human diseases,2021,,,
10.3389/fnagi.2025.1587986,"Insights into targeted ferroptosis in mechanisms, biology, and role of Alzheimer's disease: an update",2025,,,
10.1007/s12021-012-9166-x,Towards Semi-Automatic Reconstruction of Neural Circuits,2012,,,
10.3389/fnins.2024.1524577,"Harnessing the potential of human induced pluripotent stem cells, functional assays and machine learning for neurodevelopmental disorders",2025,,,
10.1007/s00018-025-05690-0,Multiple sclerosis: what have we learned and can we still learn from electron microscopy,2025,,,
10.1016/j.cub.2025.11.037,Species-specific spectral tuning of motion vision in butterflies,2025,,,
10.64898/2026.02.09.703982,Filopodia-mediated trans-endocytosis,2026,,,
10.1142/s012906572050063x,On the Modeling of the Three Types of Non-spiking Neurons of the Caenorhabditis elegans,2020,,,
10.1007/bf01954145,A simple post-embedding system for the rapid demonstration of tissue antigens under the electron microscope,1983,,,
10.1038/srep05918,A new method for constructing networks from binary data,2014,,,
10.1049/ipr2.12419,Medical image segmentation using deep learning: A survey,2022,,,
10.1159/000444713,Epigenetic Regulations of GABAergic Neurotransmission: Relevance for Neurological Disorders and Epigenetic Therapy,2016,,,
10.1038/nmeth.4331,webKnossos: efficient online 3D data annotation for connectomics,2017,,,
10.1016/s0197-4580(02)00065-9,Staging of brain pathology related to sporadic Parkinson’s disease,2002,,,
10.1109/tsipn.2016.2555785,Active Sensing of Social Networks,2016,,,
10.7554/elife.26975,A connectome of a learning and memory center in the adult Drosophila brain,2017,,,
10.1038/s41598-019-49431-3,Deep-Learning-Based Segmentation of Small Extracellular Vesicles in Transmission Electron Microscopy Images,2019,,,
10.1145/331499.331504,Data clustering,1999,,,
10.1007/978-3-030-11024-6_33,A Benchmark for Epithelial Cell Tracking,2019,,,
10.1152/physrev.00038.2021,"ER-phagy: mechanisms, regulation, and diseases connected to the lysosomal clearance of the endoplasmic reticulum",2022,,,
10.1038/s41418-023-01153-w,Apoptotic cell death in disease—Current understanding of the NCCD 2023,2023,,,
10.1038/s41598-018-36973-1,Network Analysis of the Multidimensional Symptom Experience of Oncology,2019,,,
10.1073/pnas.1509820112,Synaptic circuits and their variations within different columns in the visual system of <i>Drosophila</i>,2015,,,
10.1016/j.osnem.2018.12.001,Source detection of rumor in social network – A review,2019,,,
10.1038/msb.2011.99,Differential network biology,2012,,,
10.1101/2025.04.24.650400,Maturation of GABAergic signalling times the opening of a critical period in <i>Drosophila melanogaster</i>,2025,False,preprint,biorxiv
10.1021/acsnano.7b01493,Emerging Trends in Micro- and Nanoscale Technologies in Medicine: From Basic Discoveries to Translation,2017,,,
10.1038/nrg1272,Network biology: understanding the cell's functional organization,2004,,,
10.1098/rspb.1993.0040,The organization of neural systems in the primate cerebral cortex,1993,,,
10.1007/s10462-022-10321-2,"A survey of graph neural networks in various learning paradigms: methods, applications, and challenges",2022,,,
10.1038/s41593-023-01257-z,Perivascular cells induce microglial phagocytic states and synaptic engulfment via SPP1 in mouse models of Alzheimer’s disease,2023,,,
10.1002/nbm.782,The basis of anisotropic water diffusion in the nervous system – a technical review,2002,,,
10.1016/bs.aecr.2015.10.005,10 Years Later,2015,,,
10.1186/s12964-023-01108-1,"Pyroptosis, ferroptosis, and autophagy cross-talk in glioblastoma opens up new avenues for glioblastoma treatment",2023,,,
10.1534/genetics.118.300227,"Imaging Flies by Fluorescence Microscopy: Principles, Technologies, and Applications",2018,,,
10.1259/bjr.20181000,"Progress in psychoradiology, the clinical application of psychiatric neuroimaging",2019,,,
10.1029/2021gl093387,Growth of the Northeastern Tibetan Plateau Driven by Crustal Channel Flow: Evidence From High‐Resolution Ambient Noise Imaging,2021,,,
10.1016/j.apm.2017.07.012,A new centrality measure of nodes in multilayer networks under the framework of tensor computation,2017,,,
10.1109/jas.2022.105737,Networked Knowledge and Complex Networks: An Engineering View,2022,,,
10.1038/s41586-024-07763-9,A Drosophila computational brain model reveals sensorimotor processing,2024,,,
10.1038/s41586-025-08790-w,Functional connectomics spanning multiple areas of mouse visual cortex,2025,,,
10.1186/s40478-021-01283-7,Inhibition of LRRK2 kinase activity promotes anterograde axonal transport and presynaptic targeting of α-synuclein,2021,,,
10.1111/ejn.15639,Quantification of neuron types in the rodent hippocampal formation by data mining and numerical optimization,2022,,,
10.3389/fncel.2021.686722,Functional Genomics of Axons and Synapses to Understand Neurodegenerative Diseases,2021,,,
10.1016/j.nantod.2023.101865,The role of mesenchymal stem cell-derived extracellular vesicles in inflammation-associated programmed cell death,2023,,,
10.1080/15548627.2021.1995151,An exploratory text analysis of the autophagy research field,2021,,,
10.20944/preprints202308.1210.v1,Theory of Morphodynamic Information Processing: Linking Sensing to Behaviour,2023,,,
10.1038/s41467-025-66708-6,"Mitochondria are absent from microglial processes performing surveillance, chemotaxis, and phagocytic engulfment",2025,,,
10.1016/j.neuron.2025.10.030,Ultrastructural membrane dynamics of mouse and human cortical synapses,2025,,,
10.1101/2025.03.12.642538,Peptidergic top-down control of metabolic state-dependent behavioral decisions in a conflicting sensory context,2025,False,preprint,biorxiv
10.3389/fnsyn.2025.1724377,"Synaptic transmission in supragranular layers of the human cortex – comparative review of structure, function, and plasticity",2025,,,
10.1056/nejmoa1200690,"Safety, Activity, and Immune Correlates of Anti–PD-1 Antibody in Cancer",2012,,,
10.1038/s41586-024-07981-1,Neuronal parts list and wiring diagram for a visual system,2024,,,
10.1016/s0140-6736(18)32279-7,"Global, regional, and national incidence, prevalence, and years lived with disability for 354 diseases and injuries for 195 countries and territories, 1990–2017: a systematic analysis for the Global Burden of Disease Study 2017",2018,,,
10.1016/s0140-6736(12)61729-2,Years lived with disability (YLDs) for 1160 sequelae of 289 diseases and injuries 1990–2010: a systematic analysis for the Global Burden of Disease Study 2010,2012,,,
10.1145/3132847.3132909,Multi-view Clustering with Graph Embedding for Connectome Analysis,2017,,,
10.1038/nature06639,Autophagy fights disease through cellular self-digestion,2008,,,
10.1016/j.cels.2015.12.004,The Molecular Signatures Database Hallmark Gene Set Collection,2015,,,
10.3389/fcell.2024.1348894,The role of LncRNA-mediated autophagy in cancer progression,2024,,,
10.1038/nature05758,Intrinsic functional architecture in the anaesthetized monkey brain,2007,,,
10.3389/fpsyg.2015.00328,Advancing understanding of executive function impairments and psychopathology: bridging the gap between clinical and cognitive approaches,2015,,,
10.1006/cbmr.1996.0014,AFNI: Software for Analysis and Visualization of Functional Magnetic Resonance Neuroimages,1996,,,
10.1016/j.isci.2024.108825,Spatial patterns of noise-induced inner hair cell ribbon loss in the mouse mid-cochlea,2024,,,
10.1073/pnas.1807305115,Metabolic network-based stratification of hepatocellular carcinoma reveals three distinct tumor subtypes,2018,,,
10.1073/pnas.0308627101,Default-mode network activity distinguishes Alzheimer's disease from healthy aging: Evidence from functional MRI,2004,,,
10.1038/nrn3169,Structural neurobiology: missing link to a mechanistic understanding of neural computation,2012,,,
10.1523/jneurosci.2009-17.2017,Human Brain-Derived Aβ Oligomers Bind to Synapses and Disrupt Synaptic Activity in a Manner That Requires APP,2017,,,
10.1002/adfm.202203323,Recent Advances in Stimuli‐Responsive Shape‐Morphing Hydrogels,2022,,,
10.1016/j.neuron.2012.10.002,The Neuronal Organization of the Retina,2012,,,
10.1007/s11548-017-1649-7,Ultrasound image-based thyroid nodule automatic segmentation using convolutional neural networks,2017,,,
10.1016/j.jsb.2006.03.006,Site-specific 3D imaging of cells and tissues with a dual beam microscope,2006,,,
10.1609/icwsm.v3i1.13937,Gephi: An Open Source Software for Exploring and Manipulating Networks,2009,,,
10.1002/hbm.24902,Dynamic changes of amplitude of low‐frequency fluctuations in patients with generalized anxiety disorder,2019,,,
10.1038/s41586-022-04777-z,Neuropathic pain caused by miswiring and abnormal end organ targeting,2022,,,
10.1038/s41586-024-07487-w,Accurate structure prediction of biomolecular interactions with AlphaFold 3,2024,,,
10.1038/s41583-018-0038-8,On the nature and use of models in network neuroscience,2018,,,
10.1109/tpds.2013.2297115,To Shut Them Up or to Clarify: Restraining the Spread of Rumors in Online Social Networks,2014,,,
10.7554/elife.40766,An afferent white matter pathway from the pulvinar to the amygdala facilitates fear recognition,2019,,,
10.1038/s41598-016-0001-8,Ultrastructural Characterization of the Lower Motor System in a Mouse Model of Krabbe Disease,2016,,,
10.1038/s41592-023-02053-0,Genetically encoded multimeric tags for subcellular protein localization in cryo-EM,2023,,,
10.3389/fncir.2012.00026,Inhibitory Regulation of Dendritic Activity in vivo,2012,,,
10.1093/brain/awy275,Local structural connectivity is associated with social cognition in autism spectrum disorder,2018,,,
10.3389/fnhum.2019.00017,The Importance of the Validation of M/EEG With Current Biomarkers in Alzheimer's Disease,2019,,,
10.1016/j.xcrm.2023.101175,Human astrocytes and microglia show augmented ingestion of synapses in Alzheimer’s disease via MFG-E8,2023,,,
10.1155/2021/5548884,The Understanding of Deep Learning: A Comprehensive Review,2021,,,
10.3389/fpsyg.2016.00588,"Intelligence, Cognition, and Language of Green Plants",2016,,,
10.1088/0031-9155/55/12/018,Improved dose-calculation accuracy in proton treatment planning using a simplified Monte Carlo method verified with three-dimensional measurements in an anthropomorphic phantom,2010,,,
10.1002/pmic.201100594,Protein interaction networks in medicine and disease,2012,,,
10.1107/s0021889802022112,Single-crystal structure validation with the program<i>PLATON</i>,2003,,,
10.1016/j.cell.2023.12.017,Understanding the cell: Future views of structural biology,2024,,,
10.1029/2017jb015104,Uncovering the Iceland Hot Spot Track Beneath Greenland,2018,,,
10.1038/s41467-021-23292-9,Network isolators inhibit failure spreading in complex networks,2021,,,
10.1007/s41109-018-0092-1,"Topology, robustness, and structural controllability of the Brazilian Federal Police criminal intelligence network",2018,,,
10.1016/j.jvolgeores.2019.07.015,Seismic perspectives from the western U.S. on magma reservoirs underlying large silicic calderas,2019,,,
10.3762/bjoc.13.147,Grip on complexity in chemical reaction networks,2017,,,
10.1088/1367-2630/17/1/013044,Defining and identifying cograph communities in complex networks,2015,,,
10.3389/fphys.2018.00916,Metabolic Network-Based Identification and Prioritization of Anticancer Targets Based on Expression Data in Hepatocellular Carcinoma,2018,,,
10.1109/jsyst.2019.2900027,"Cyber-Social Systems: Modeling, Inference, and Optimal Design",2019,,,
10.1016/s1053-8119(03)00202-7,Dynamic causal modelling,2003,,,
10.1002/cne.21757,Synaptic circuits of the <i>Drosophila</i> optic lobe: The input terminals to the medulla,2008,,,
10.1109/tcns.2016.2548424,Gramian-Based Reachability Metrics for Bilinear Networks,2016,,,
10.1021/acscentsci.1c00919,A Highly Sensitive Fluorescent Akt Biosensor Reveals Lysosome-Selective Regulation of Lipid Second Messengers and Kinase Activity,2021,,,
10.1038/s41398-019-0427-4,Three-dimensional alteration of neurites in schizophrenia,2019,,,
10.1016/j.media.2012.06.004,Vectorization of optically sectioned brain microvasculature: Learning aids completion of vascular graphs by connecting gaps and deleting open-ended segments,2012,,,
10.1113/ep085776,"From single cells and single columns to cortical networks: dendritic excitability, coincidence detection and synaptic transmission in brain slices and brains",2017,,,
10.1021/acs.analchem.8b01395,Mass Spectrometry Imaging Suggests That Cisplatin Affects Exocytotic Release by Alteration of Cell Membrane Lipids,2018,,,
10.1093/nar/gky427,SWISS-MODEL: homology modelling of protein structures and complexes,2018,,,
10.1523/jneurosci.3539-11.2011,Rich-Club Organization of the Human Connectome,2011,,,
10.3389/fcell.2023.1063843,Astrocyte development—More questions than answers,2023,,,
