doi,title,year,is_paywalled,oa_status,primary_source
10.1101/2021.07.29.454371,Large-scale dendritic spine extraction and analysis through petascale computing,2021,False,preprint,biorxiv
10.64898/2026.03.01.708921,Minimal biophysical rules are sufficient for the emergence of computational intelligence at the neuronal scale,2026,,,
10.1016/j.sbi.2011.06.010,"The power of correlative microscopy: multi-modal, multi-scale, multi-dimensional",2011,,,
10.1038/s42003-023-04857-4,"Light-sheets and smart microscopy, an exciting future is dawning",2023,,,
10.1016/j.isci.2022.104180,Classifying Drosophila olfactory projection neuron boutons by quantitative analysis of electron microscopic reconstruction,2022,,,
10.1523/jneurosci.4013-15.2016,Retinal Circuitry Balances Contrast Tuning of Excitation and Inhibition to Enable Reliable Computation of Direction Selectivity,2016,,,
10.1093/brain/awr331,Parietofrontal integrity determines neural modulation associated with grasping imagery after stroke,2012,,,
10.1073/pnas.1121558109,Correlative 3D superresolution fluorescence and electron microscopy reveal the relationship of mitochondrial nucleoids to membranes,2012,,,
10.1523/jneurosci.2060-18.2019,The Human Ventromedial Prefrontal Cortex: Sulcal Morphology and Its Influence on Functional Organization,2019,,,
10.1016/s1053-8119(02)91132-8,Improved Optimization for the Robust and Accurate Linear Registration and Motion Correction of Brain Images,2002,,,
10.3389/fphy.2020.00047,Correlated Multimodal Imaging in Life Sciences: Expanding the Biomedical Horizon,2020,,,
10.1002/rcm.7285,"Mass spectrometric imaging of brain tissue by time‐of‐flight secondary ion mass spectrometry – How do polyatomic primary beams C <sub>60</sub> <sup>+</sup> , Ar <sub>2000</sub> <sup>+</sup> , water‐doped Ar <sub>2000</sub> <sup>+</sup> and (H <sub>2</sub> O) <sub>6000</sub> <sup>+</sup> compare?",2015,,,
10.1093/nar/gkw784,smiFISH and FISH-quant – a flexible single RNA detection approach with super-resolution capability,2016,,,
10.1007/s00024-018-2041-4,Shallow Crustal Structure of the Tanlu Fault Zone Near Chao Lake in Eastern China by Direct Surface Wave Tomography from Local Dense Array Ambient Noise Analysis,2018,,,
10.1016/j.intell.2022.101654,On the prediction of human intelligence from neuroimaging: A systematic review of methods and reporting,2022,,,
10.3389/fnins.2022.796129,Imaging Synaptic Density: The Next Holy Grail of Neuroscience?,2022,,,
10.1093/gji/ggu071,Rayleigh wave tomography of the British Isles from ambient seismic noise,2014,,,
10.3389/fnins.2016.00381,The Voxel-Wise Functional Connectome Can Be Efficiently Derived from Co-activations in a Sparse Spatio-Temporal Point-Process,2016,,,
10.1038/s41467-017-01980-9,Electrical synapses convey orientation selectivity in the mouse retina,2017,,,
10.1534/genetics.114.172510,Brainbow: New Resources and Emerging Biological Applications for Multicolor Genetic Labeling and Analysis,2015,,,
10.1016/b978-0-12-416026-2.00018-2,Correlative Light and Volume Electron Microscopy,2012,,,
10.1016/j.media.2020.101799,A unified framework for multimodal structure–function mapping based on eigenmodes,2020,,,
10.1016/j.xgen.2025.101103,A high-resolution atlas of the brain predicts lineage and birth order underlying neuronal identity,2025,,,
10.1016/j.eswa.2025.128871,Mining neural connectivity via spatiotemporal features of neural calcium activity data,2025,,,
10.1016/j.sbi.2022.102444,Electron microscopy of cellular ultrastructure in three dimensions,2022,,,
10.1016/j.biopsych.2015.02.020,"Depressive Rumination, the Default-Mode Network, and the Dark Matter of Clinical Neuroscience",2015,,,
10.3390/insects13040332,Multimodal Information Processing and Associative Learning in the Insect Brain,2022,,,
10.1063/1.3050879,<i>The Structure of Scientific Revolutions</i>,1963,,,
10.1186/1742-9994-10-44,"A correlative approach for combining microCT, light and transmission electron microscopy in a single 3D scenario",2013,,,
10.1038/s41592-024-02401-8,Collaborative augmented reconstruction of 3D neuron morphology in mouse and human brains,2024,,,
10.1371/journal.pone.0124581,Correlative Stochastic Optical Reconstruction Microscopy and Electron Microscopy,2015,,,
10.1016/b978-0-12-416026-2.00017-0,Bridging Microscopes,2012,,,
10.1093/nar/gkab120,Barcoded oligonucleotides ligated on RNA amplified for multiplexed and parallel <i>in situ</i> analyses,2021,,,
10.1371/journal.pcbi.1007983,Task-evoked activity quenches neural correlations and variability across cortical areas,2020,,,
10.1038/s41596-020-00414-z,Antigen retrieval and clearing for whole-organ immunofluorescence by FLASH,2020,,,
10.1111/jmi.12841,Expansion microscopy for the analysis of centrioles and cilia,2019,,,
10.1038/srep43105,"Rumination and Default Mode Network Subsystems Connectivity in First-episode, Drug-Naive Young Patients with Major Depressive Disorder",2017,,,
10.1016/j.neuron.2015.03.031,The Mutual Inspirations of Machine Learning and Neuroscience,2015,,,
10.1371/journal.pbio.2002612,A multiscale cerebral neurochemical connectome of the rat brain,2017,,,
10.1016/j.neuroimage.2016.11.008,The connectomics of brain demyelination: Functional and structural patterns in the cuprizone mouse model,2016,,,
10.1073/pnas.2312281120,Structure and function of the hippocampal CA3 module,2024,,,
10.1093/cercor/bhy055,Toward Task Connectomics: Examining Whole-Brain Task Modulated Connectivity in Different Task Domains,2018,,,
10.1016/j.tins.2022.03.005,Retinal receptive-field substructure: scaffolding for coding and computation,2022,,,
10.1101/2023.06.27.546055,Whole-brain annotation and multi-connectome cell typing quantifies circuit stereotypy in <i>Drosophila</i>,2023,False,preprint,biorxiv
10.1016/j.conb.2023.102748,Circuits for self-motion estimation and walking control in Drosophila,2023,,,
10.1073/pnas.2413422121,Neural network architecture of a mammalian brain,2024,,,
10.1101/2020.08.20.259135,Circuit reorganization in the <i>Drosophila</i> mushroom body calyx accompanies memory consolidation,2020,False,preprint,biorxiv
10.1016/j.cub.2025.12.024,A neural connectivity atlas for fly flight control,2026,,,
10.1101/2025.05.27.656373,Sequential formation of Drosophila circuit asymmetry via prolonged structural plasticity,2025,False,preprint,biorxiv
10.1101/143727,Conserved neural circuit structure across <i>Drosophila</i> larval development revealed by comparative connectomics,2017,False,preprint,biorxiv
10.1101/2021.09.20.461071,The anterior paired lateral neuron normalizes odour-evoked activity at the mushroom body calyx,2021,False,preprint,biorxiv
10.1016/j.neuron.2014.08.001,The Stimulus Selectivity and Connectivity of Layer Six Principal Cells Reveals Cortical Microcircuits Underlying Visual Processing,2014,,,
10.1103/physrevlett.109.205703,Core Percolation on Complex Networks,2012,,,
10.1523/jneurosci.1677-18.2018,Whole-Brain Analysis of Cells and Circuits by Tissue Clearing and Light-Sheet Microscopy,2018,,,
10.1016/j.isci.2024.111585,"Heterogeneous and higher-order cortical connectivity undergirds efficient, robust, and reliable neural codes",2024,,,
10.1016/j.neubiorev.2011.09.003,"Brain connectivity and high functioning autism: A promising path of research that needs refined models, methodological convergence, and stronger behavioral links",2011,,,
10.1038/s41467-018-03359-w,Next generation histology methods for three-dimensional imaging of fresh and archival human brain tissues,2018,,,
10.1017/s1551929515000012,Multiple-Beam Scanning Electron Microscopy,2015,,,
10.3389/fcell.2020.00617,Using Expansion Microscopy to Visualize and Characterize the Morphology of Mitochondrial Cristae,2020,,,
10.1101/2025.06.04.657818,A High-Resolution Atlas of the Brain Predicts Lineage and Birth Order Underly Neuronal Identity,2025,False,preprint,biorxiv
10.1016/j.cub.2021.11.005,Dendro-somatic synaptic inputs to ganglion cells contradict receptive field and connectivity conventions in the mammalian retina,2021,,,
10.1038/ngeo1036,Complex and variable crustal and uppermost mantle seismic anisotropy in the western United States,2010,,,
10.1093/gji/ggu217,Ambient noise surface wave tomography to determine the shallow shear velocity structure at Valhall: depth inversion with a Neighbourhood Algorithm,2014,,,
10.1101/2021.12.11.472218,Neural mechanisms to exploit positional geometry for collision avoidance,2021,False,preprint,biorxiv
10.1016/j.bspc.2021.102829,An effective AI integrated system for neuron tracing on anisotropic electron microscopy volume,2021,,,
10.1007/978-3-030-87237-3_42,Learning Neuron Stitching for Connectomics,2021,,,
10.1785/0220190364,NoisePy: A New High-Performance Python Tool for Ambient-Noise Seismology,2020,,,
10.1038/s41467-019-09344-1,The architecture of functional lateralisation and its relationship to callosal connectivity in the human brain,2019,,,
10.1101/cshperspect.a021758,Structural Components of Synaptic Plasticity and Memory Consolidation,2015,False,preprint,biorxiv
10.1038/s41467-019-10268-z,Neural mechanisms of contextual modulation in the retinal direction selective circuit,2019,,,
10.1016/j.neuron.2013.01.020,Probing and Regulating Dysfunctional Circuits Using Deep Brain Stimulation,2013,,,
10.1029/2018jb016595,Frequency‐Bessel Transform Method for Effective Imaging of Higher‐Mode Rayleigh Dispersion Curves From Ambient Seismic Noise Data,2019,,,
10.1016/j.celrep.2019.09.006,Synaptic Specializations of Melanopsin-Retinal Ganglion Cells in Multiple Brain Regions Revealed by Genetic Label for Light and Electron Microscopy,2019,,,
10.7554/elife.82093,Presynaptic contact and activity opposingly regulate postsynaptic dendrite outgrowth,2022,,,
10.3389/fnins.2021.787753,"Open Frontiers in Neural Cell Type Investigations; Lessons From Caenorhabditis elegans and Beyond, Toward a Multimodal Integration",2022,,,
10.1126/sciadv.abn2293,Uncovering the biological basis of control energy: Structural and metabolic correlates of energy inefficiency in temporal lobe epilepsy,2022,,,
10.1016/s0091-679x(10)96015-9,Three-Dimensional Reconstruction Methods for Caenorhabditis elegans Ultrastructure,2010,,,
10.1038/sdata.2017.17,Longitudinal test-retest neuroimaging data from healthy young adults in southwest China,2017,,,
10.1111/jmi.12071,Integration of a high‐NA light microscope in a scanning electron microscope,2013,,,
10.3389/fnana.2018.00059,NeuroMorph: A Software Toolset for 3D Analysis of Neurite Morphology and Connectivity,2018,,,
10.1038/d41586-020-02947-5,Probing fine-scale connections in the brain,2020,,,
10.1101/2025.05.29.656834,Neural connectivity of a computational map for fly flight control,2025,False,preprint,biorxiv
10.1016/j.cub.2023.05.007,Disynaptic inhibition shapes tuning of OFF-motion detectors in Drosophila,2023,,,
10.1093/gji/ggv054,Inferring the oriented elastic tensor from surface wave observations: preliminary application across the western United States,2015,,,
10.1073/pnas.1220285110,Conserved MIP receptor–ligand pair regulates <i>Platynereis</i> larval settlement,2013,,,
10.1190/1.3457445,Tutorial on seismic interferometry: Part 1 — Basic principles and applications,2010,,,
10.1038/mp.2012.105,Why has it taken so long for biological psychiatry to develop clinical tests and what to do about it?,2012,,,
10.3390/jimaging5090075,Segmentation and Modelling of the Nuclear Envelope of HeLa Cells Imaged with Serial Block Face Scanning Electron Microscopy,2019,,,
10.1093/gji/ggv043,On the limitations of interstation distances in ambient noise tomography,2015,,,
10.48550/arxiv.1702.07386,Toward Streaming Synapse Detection with Compositional ConvNets,2017,,,
10.1111/pcn.12839,Mapping causal pathways from genetics to neuropsychiatric disorders using genome‐wide imaging genetics: Current status and future directions,2019,,,
10.1085/jgp.201812227,A primer on resolving the nanoscale structure of the plasma membrane with light and electron microscopy,2019,,,
10.1002/9783527803910.ch7,Image Processing and Analysis of Light Sheet Microscopy Data,2024,,,
10.1101/2025.07.10.664244,Neuron-Microenvironments Associated with Specific Long-Range Connectivity Reveal Functional Modules in the Adult <i>Drosophila</i> Brain,2025,False,preprint,biorxiv
10.1186/s12915-026-02539-1,Emergence of clustered synapses during the development of a nervous system,2026,,,
10.1785/0220150257,"3D Near‐Surface Shear‐Wave Velocity Structure from Ambient‐Noise Tomography and Borehole Data in the Hefei Urban Area, China",2016,,,
10.1785/0120080947,Testing Community Velocity Models for Southern California Using the Ambient Seismic Field,2008,,,
10.1109/iccvw.2019.00473,Removing Imaging Artifacts in Electron Microscopy using an Asymmetrically Cyclic Adversarial Network without Paired Training Data,2019,,,
10.1371/journal.pbio.3000268,Mechanically resolved imaging of bacteria using expansion microscopy,2019,,,
10.1016/j.cub.2024.04.003,Mechanosensory and command contributions to the Drosophila grooming sequence,2024,,,
10.1016/j.tics.2017.03.002,A Network Model of the Emotional Brain,2017,,,
10.1371/journal.pone.0033799,Hierarchy Measure for Complex Networks,2012,,,
10.1016/j.tecto.2011.12.004,Generalised receiver functions and seismic interferometry,2011,,,
10.1126/science.aba3163,A brainwide atlas of synapses across the mouse life span,2020,,,
10.1088/1367-2630/9/5/110,Criticality of spreading dynamics in hierarchical cluster networks without inhibition,2007,,,
10.1371/journal.pone.0038011,TrakEM2 Software for Neural Circuit Reconstruction,2012,,,
10.1038/s41467-022-32595-4,Population-based tract-to-region connectome of the human brain and its hierarchical topology,2022,,,
10.1038/s42005-019-0152-6,Complex networks from classical to quantum,2019,,,
10.1016/j.neuroimage.2020.116828,Idiosynchrony: From shared responses to individual differences during naturalistic neuroimaging,2020,,,
10.1038/s41598-018-31231-w,Biological serial block face scanning electron microscopy at improved z-resolution based on Monte Carlo model,2018,,,
10.1002/glia.23632,A roadmap to integrate astrocytes into Systems Neuroscience,2019,,,
10.1038/nature12450,A visual motion detection circuit suggested by Drosophila connectomics,2013,,,
10.1089/brain.2011.0071,Characterization of Cerebral White Matter Properties Using Quantitative Magnetic Resonance Imaging Stains,2011,,,
10.1016/j.neuroimage.2016.06.002,Multi-compartment microscopic diffusion imaging,2016,,,
10.1109/jbhi.2019.2961792,Mitochondria Segmentation From EM Images via Hierarchical Structured Contextual Forest,2019,,,
10.1002/adma.202307747,Synergistic Pharmacological Therapy to Modulate Glial Cells in Spinal Cord Injury,2023,,,
10.3389/fnana.2016.00060,Comments and General Discussion on “The Anatomical Problem Posed by Brain Complexity and Size: A Potential Solution”,2016,,,
10.3389/fncel.2022.1070438,Volume electron microscopy reveals age-related circuit remodeling in the auditory brainstem,2022,,,
10.7554/elife.91387,Four individually identified paired dopamine neurons signal taste punishment in larval Drosophila,2023,,,
10.1038/s41593-024-01570-1,Mapping dysfunctional circuits in the frontal cortex using deep brain stimulation,2024,,,
10.1101/2023.04.02.532814,A single neuron in <i>C. elegans</i> orchestrates multiple motor outputs through parallel modes of transmission,2023,False,preprint,biorxiv
10.48550/arxiv.2301.00345,MTNeuro: A Benchmark for Evaluating Representations of Brain Structure Across Multiple Levels of Abstraction,2023,,,
10.1016/j.conb.2025.103112,Formation of sensory maps: New tools reveal novel insights into neural development,2025,,,
10.1101/2025.11.15.688637,Population Morphology Implies a Common Developmental Blueprint for <i>Drosophila</i> Motion Detectors,2025,False,preprint,biorxiv
10.1038/srep18631,ACT-PRESTO: Rapid and consistent tissue clearing and labeling method for 3-dimensional (3D) imaging,2016,,,
10.3182/20140824-6-za-1003.00226,Optimal Sensor and Actuator Placement in Complex Dynamical Networks,2014,,,
10.7554/elife.83739,Generative network modeling reveals quantitative definitions of bilateral symmetry exhibited by a whole insect brain connectome,2023,,,
10.1038/nature14236,Human-level control through deep reinforcement learning,2015,,,
10.1093/brain/awy008,Left frontal hub connectivity delays cognitive impairment in autosomal-dominant and sporadic Alzheimer’s disease,2018,,,
10.1038/s41562-017-0146,Functional corticostriatal connection topographies predict goal-directed behaviour in humans,2017,,,
10.1073/pnas.0135058100,Functional connectivity in the resting brain: A network analysis of the default mode hypothesis,2002,,,
10.1016/j.physa.2012.04.019,Robustness analysis of network controllability,2012,,,
10.1002/mrm.20426,RESTORE: Robust estimation of tensors by outlier rejection,2005,,,
10.1016/j.pgeola.2011.04.002,Seismic interferometry and ambient noise tomography in the British Isles,2011,,,
10.1038/nphys2160,Modelling dynamical processes in complex socio-technical systems,2011,,,
10.1038/s44319-025-00476-8,"An integrated anatomical, functional and evolutionary view of the Drosophila olfactory system",2025,,,
10.48550/arxiv.1409.1199,Focused Proofreading: Efficiently Extracting Connectomes from Segmented EM Images,2014,,,
10.1016/j.cell.2024.06.022,Molecular and cellular mechanisms of teneurin signaling in synaptic partner matching,2024,,,
10.1098/rstb.2015.0111,Establishing a link between sex-related differences in the structural connectome and behaviour,2016,,,
10.1371/journal.pcbi.1005203,Quantifying Differences and Similarities in Whole-Brain White Matter Architecture Using Local Connectome Fingerprints,2016,,,
10.3390/jdb7020008,Novel Technological Advances in Functional Connectomics in C. elegans,2019,,,
10.1371/journal.pcbi.1009205,Models of heterogeneous dopamine signaling in an insect learning and memory center,2021,,,
10.1016/j.media.2018.03.013,Integration of temporal and spatial properties of dynamic connectivity networks for automatic diagnosis of brain disease,2018,,,
10.1042/ns20220013,Array tomography: 15 years of synaptic analysis,2022,,,
10.1016/j.celrep.2018.10.089,Synaptic Convergence Patterns onto Retinal Ganglion Cells Are Preserved despite Topographic Variation in Pre- and Postsynaptic Territories,2018,,,
10.1111/jmi.12086,Controlling FIB‐SBEM slice thickness by monitoring the transmitted ion beam,2013,,,
10.1016/j.neubiorev.2017.04.028,Progressive cortical reorganisation: A framework for investigating structural changes in schizophrenia,2017,,,
10.1109/tcbb.2013.72,Multiobjective Identification of Controlling Areas in Neuronal Networks,2013,,,
10.1101/2020.02.18.954354,An anatomical substrate of credit assignment in reinforcement learning,2020,False,preprint,biorxiv
10.1038/s41588-022-01039-6,Common variants contribute to intrinsic human brain functional networks,2022,,,
10.53846/goediss-10513,Conservation and divergence of the retinal homeobox genetic neural lineage between Drosophila melanogaster and Tribolium castaneum,2024,,,
10.1785/0120090319,Phase Velocity Variation at Periods of 0.5-3 Seconds in the Taipei Basin of Taiwan from Correlation of Ambient Seismic Noise,2010,,,
10.1186/s12868-024-00919-3,The songbird connectome (OSCINE-NET.ORG): structure–function organization beyond the canonical vocal control network,2024,,,
10.1038/s41467-025-64907-9,A neural circuit for context-dependent multimodal signaling in Drosophila,2025,,,
10.1371/journal.pbio.3003094,Inhibitory circuit motifs in Drosophila larvae generate motor program diversity and variability,2025,,,
10.55162/mcms.05.151,Potential Information Processing Differences in Male and Hermaphrodite Neural Networks of Caenorhabditis elegans,2023,,,
10.1101/2025.11.03.683805,CeDNe: A multi-scale computational framework for modeling structure-function relationships in the <i>C. elegans</i> nervous system,2025,False,preprint,biorxiv
10.1038/s41467-025-65900-y,The Vap33 signaling axis precisely coordinates the timing of motoneuron dendritogenesis in neural map development,2025,,,
10.1073/pnas.2516572123,A data-driven framework linking the connectome to spatial gene expression gradients inspired by chemoaffinity theory,2026,,,
10.1101/2025.07.14.664689,Fishexplorer: A multimodal cellular atlas platform for neuronal circuit dissection in larval zebrafish,2025,False,preprint,biorxiv
10.1101/2022.08.18.504452,A premotor microcircuit to generate behavior-specific muscle activation patterns in Drosophila larvae,2022,False,preprint,biorxiv
10.3389/fopht.2022.989002,On and off signaling pathways in the retina and the visual system,2022,,,
10.1007/s11589-010-0744-4,Three dimensional shear wave velocity structure of the crust and upper mantle beneath China from ambient noise surface wave tomography,2010,,,
10.1016/j.patcog.2008.08.009,Automatic joint classification and segmentation of whole cell 3D images,2008,,,
10.1016/j.cmpb.2022.106959,Automatic segmentation and reconstruction of intracellular compartments in volumetric electron microscopy data,2022,,,
10.1101/2024.08.11.607076,Neural Sequences Underlying Directed Turning in <i>C. elegans</i>,2024,False,preprint,biorxiv
10.1085/jgp.202012814,The role of molecular diffusion within dendritic spines in synaptic function,2021,,,
10.1093/bioadv/vbaf021,Transfer learning improves performance in volumetric electron microscopy organelle segmentation across tissues,2024,,,
10.7554/elife.73783,Structure and function of axo-axonic inhibition,2021,,,
10.3109/01677063.2014.891590,Multiple Redundant Medulla Projection Neurons Mediate Color Vision in<i>Drosophila</i>,2014,,,
10.1209/0295-5075/111/56001,Interdisciplinary and physics challenges of network theory,2015,,,
10.1039/9781837674763-part1,Fundamentals and Advancements,2025,,,
10.3389/fcimb.2019.00276,Detection of Chlamydia Developmental Forms and Secreted Effectors by Expansion Microscopy,2019,,,
10.1017/s0033291719001934,"Detecting schizophrenia at the level of the individual: relative diagnostic value of whole-brain images, connectome-wide functional connectivity and graph-based metrics",2019,,,
10.1146/annurev-biophys-052118-115655,Mechanisms of Sensory Discrimination: Insights from<i>Drosophila</i>Olfaction,2019,,,
10.1017/s1431927621011958,Preparation of Samples for Large-Scale Automated Electron Microscopy of Tissue and Cell Ultrastructure,2021,,,
10.1016/j.conb.2021.11.008,"The conserved core of the nereid brain: Circular CNS, apical nervous system and lhx6-arx-dlx neurons",2021,,,
10.1523/jneurosci.0155-18.2018,Schaffer Collateral Inputs to CA1 Excitatory and Inhibitory Neurons Follow Different Connectivity Rules,2018,,,
10.1371/journal.pone.0236883,The frequent complete subgraphs in the human connectome,2020,,,
10.1007/s10827-014-0497-5,Connectomic constraints on computation in feedforward networks of spiking neurons,2014,,,
10.1109/access.2021.3084066,ZeVis: A Visual Analytics System for Exploration of a Larval Zebrafish Brain in Serial-Section Electron Microscopy Images,2021,,,
10.1101/2021.07.11.451911,Circuit motifs and graph properties of connectome development in <i>C. elegans</i>,2021,False,preprint,biorxiv
10.1107/s0907444904019158,<i>Coot</i>: model-building tools for molecular graphics,2004,,,
10.1101/2025.10.16.682869,Synapse Detection Efficiency in EM <i>Drosophila</i> Connectomics,2025,False,preprint,biorxiv
10.1101/2025.09.26.678749,"A multisensory, bidirectional, valence encoder guides behavioral decisions",2025,False,preprint,biorxiv
10.1101/2024.12.06.627294,The Functional Connectome Mediating Circadian Synchrony in the Suprachiasmatic Nucleus,2024,False,preprint,biorxiv
10.1016/j.isci.2025.113817,Dual roles of Drosophila reward-encoding dopamine neurons in regulating innate and learned behaviors,2025,,,
10.1109/tmi.2025.3584726,ssEM Image Restoration via Diffusion Models With Multi-Output Joint Strategy for Noise Estimation,2025,,,
10.1016/j.isci.2025.114313,Deriving connectivity from spiking activity in detailed models of large-scale cortical microcircuits,2025,,,
10.1016/j.epsl.2011.11.004,Crustal structure beneath the Dabie orogenic belt from ambient noise tomography,2011,,,
10.1038/s41592-024-02580-4,Segment Anything for Microscopy,2025,,,
10.1016/j.neuroimage.2021.118250,Multi-modal imaging of a single mouse brain over five orders of magnitude of resolution,2021,,,
10.1038/srep02773,Quantum Google in a Complex Network,2013,,,
10.1038/35011540,From molecular to modular cell biology,1999,,,
10.1038/s41467-024-48146-y,A modular framework for multi-scale tissue imaging and neuronal segmentation,2024,,,
10.1038/s41467-019-12372-6,Multiplexed and high-throughput neuronal fluorescence imaging with diffusible probes,2019,,,
10.1101/457820,Oxygen plasma focused ion beam scanning electron microscopy for biological samples,2018,False,preprint,biorxiv
10.1007/978-3-540-71512-2,Handbook of Brain Connectivity,2007,,,
10.1016/j.neuroimage.2017.07.015,Recognition of white matter bundles using local and global streamline-based registration and clustering,2017,,,
10.1016/j.neuron.2020.09.005,Artificial Neural Networks for Neuroscientists: A Primer,2020,,,
10.1523/jneurosci.2999-15.2016,The Semantic Network at Work and Rest: Differential Connectivity of Anterior Temporal Lobe Subregions,2016,,,
10.1016/j.celrep.2023.113122,Dopaminergic neurons dynamically update sensory values during olfactory maneuver,2023,,,
10.1016/j.abb.2015.05.017,Correlative microscopy,2015,,,
10.1137/s003614450342480,The Structure and Function of Complex Networks,2003,,,
10.1109/83.650848,A pyramid approach to subpixel registration based on intensity,1998,,,
