doi,title,year,is_paywalled,oa_status,primary_source
10.1016/j.eswa.2025.127704,Automatic fault interpretation method embedded with clustering task in 3D-UNet3+,2025,,,
10.1016/j.preteyeres.2017.11.003,Optical coherence tomography angiography,2017,,,
10.1083/jcb.202010039,3D FIB-SEM reconstruction of microtubule–organelle interaction in whole primary mouse β cells,2020,,,
10.1016/j.cell.2023.07.035,Brain-wide representations of behavior spanning multiple timescales and states in C. elegans,2023,,,
10.7551/mitpress/1120.003.0080,Laplacian Eigenmaps and Spectral Techniques for Embedding and Clustering,2002,,,
10.1016/j.cell.2016.09.009,Competitive Disinhibition Mediates Behavioral Choice and Sequences in Drosophila,2016,,,
10.1016/s0092-8674(00)80949-6,Orexins and Orexin Receptors: A Family of Hypothalamic Neuropeptides and G Protein-Coupled Receptors that Regulate Feeding Behavior,1998,,,
10.1016/j.neuroimage.2013.05.012,Pushing spatial and temporal resolution for functional and diffusion MRI in the Human Connectome Project,2013,,,
10.1073/pnas.1921475117,Dynamic coupling of whole-brain neuronal and neurotransmitter systems,2020,,,
10.1007/s12021-020-09484-6,GTree: an Open-source Tool for Dense Reconstruction of Brain-wide Neuronal Population,2020,,,
10.1016/j.jsb.2013.05.008,Image formation modeling in cryo-electron microscopy,2013,,,
10.1093/cercor/bhp055,Where Is the Semantic System? A Critical Review and Meta-Analysis of 120 Functional Neuroimaging Studies,2009,,,
10.1016/j.semcancer.2019.10.013,The role of cell signaling in the crosstalk between autophagy and apoptosis in the regulation of tumor cell survival in response to sorafenib and neratinib,2019,,,
10.17016/ifdp.1989.355,An Econometric Analysis of UK Money Demand In Monetary Trends in the United States and the United Kingdom by Milton Friedman and Anna J. Schwartz,1989,,,
10.1038/s41598-020-79139-8,Plasma Hsp90 levels in patients with systemic sclerosis and relation to lung and skin involvement: a cross-sectional and longitudinal study,2021,,,
10.1523/jneurosci.21-16-06105.2001,Spine Formation and Correlated Assembly of Presynaptic and Postsynaptic Molecules,2001,,,
10.1023/a:1001959306025,A Note on the Statistical Power in Extended Twin Designs,2000,,,
10.1242/jeb.242740,A connectome is not enough – what is still needed to understand the brain of<i>Drosophila</i>?,2021,,,
10.1016/j.jmgm.2005.12.005,Automatic atom type and bond type perception in molecular mechanical calculations,2006,,,
10.1101/cshperspect.a000414,The Bacterial Cell Envelope,2010,False,preprint,biorxiv
10.1103/revmodphys.65.413,"Magnetoencephalography—theory, instrumentation, and applications to noninvasive studies of the working human brain",1993,,,
10.1093/eurheartj/ehx391,2017 ESC/EACTS Guidelines for the management of valvular heart disease,2017,,,
10.1523/jneurosci.4104-10.2010,Parvalbumin-Containing Fast-Spiking Basket Cells Generate the Field Potential Oscillations Induced by Cholinergic Receptor Activation in the Hippocampus,2010,,,
10.1002/jcp.29227,Modulatory effects of statins on the autophagy: A therapeutic perspective,2019,,,
10.7554/elife.53281,Feedback inhibition and its control in an insect olfactory circuit,2020,,,
10.1523/jneurosci.4466-06.2007,Direct Astrocytic Contacts Regulate Local Maturation of Dendritic Spines,2007,,,
10.1016/0304-4076(82)90103-8,Model specification tests,1982,,,
10.1038/s41596-018-0117-3,A practical guide to optimization in X10 expansion microscopy,2019,,,
10.1093/nar/gkm160,RNAmmer: consistent and rapid annotation of ribosomal RNA genes,2007,,,
10.1016/s1474-4422(18)30499-x,"Global, regional, and national burden of neurological disorders, 1990–2016: a systematic analysis for the Global Burden of Disease Study 2016",2019,,,
10.1038/nmeth.3623,Focused ion beams in biology,2015,,,
,MICE: Multivariate Imputation by Chained Equations in R,2010,,,
10.1201/b12336-12,Introduction to Graph Theory,2010,,,
10.7554/elife.24394,The comprehensive connectome of a neural substrate for ‘ON’ motion detection in Drosophila,2017,,,
10.1038/nn.2799,Structural basis for the role of inhibition in facilitating adult brain plasticity,2011,,,
10.1016/j.cell.2017.10.012,Membrane Microdomain Disassembly Inhibits MRSA Antibiotic Resistance,2017,,,
10.1155/2014/360438,"Lipid Peroxidation: Production, Metabolism, and Signaling Mechanisms of Malondialdehyde and 4-Hydroxy-2-Nonenal",2014,,,
10.1038/nature09750,Femtosecond X-ray protein nanocrystallography,2011,,,
10.1109/tmi.2022.3212780,aiWave: Volumetric Image Compression With 3-D Trained Affine Wavelet-Like Transform,2022,,,
10.1038/s41467-021-23273-y,Regulation of coordinated muscular relaxation in Drosophila larvae by a pattern-regulating intersegmental circuit,2021,,,
10.1073/pnas.92.16.7297,A versatile vector for gene and oligonucleotide transfer into cells in culture and in vivo: polyethylenimine.,1995,,,
10.1103/revmodphys.70.223,Stochastic resonance,1998,,,
10.1186/s13014-016-0717-4,"A treatment planning study of proton arc therapy for para-aortic lymph node tumors: dosimetric evaluation of conventional proton therapy, proton arc therapy, and intensity modulated radiotherapy",2016,,,
10.1016/0165-1765(80)90024-5,"Efficient tests for normality, homoscedasticity and serial independence of regression residuals",1980,,,
10.1002/dir.20015,Co-creation experiences: The next practice in value creation,2004,,,
10.1016/j.neuroimage.2013.04.087,"Graph analysis of the human connectome: Promise, progress, and pitfalls",2013,,,
10.1126/science.271.5250.776,Indeterminate Organization of the Visual System,1996,,,
10.1523/jneurosci.0764-09.2009,Signal Propagation in<i>Drosophila</i>Central Neurons,2009,,,
10.1016/j.biopha.2019.109415,Autophagy: A novel mechanism of chemoresistance in cancers,2019,,,
10.1101/2020.10.28.359620,Predicting modular functions and neural coding of behavior from a synaptic wiring diagram,2020,False,preprint,biorxiv
10.1038/s41579-020-00459-7,Characteristics of SARS-CoV-2 and COVID-19,2020,,,
10.1093/cercor/8.7.614,Dopamine innervation of a subclass of local circuit neurons in monkey prefrontal cortex: ultrastructural analysis of tyrosine hydroxylase and parvalbumin immunoreactive structures,1998,,,
10.1145/2342509.2342513,Fog computing and its role in the internet of things,2012,,,
10.1109/tc.2013.2295802,A Sword with Two Edges: Propagation Studies on Both Positive and Negative Information in Online Social Networks,2014,,,
10.1016/j.clinph.2009.08.016,"Safety, ethical considerations, and application guidelines for the use of transcranial magnetic stimulation in clinical practice and research",2009,,,
10.1038/nn.4200,Remodeling myelination: implications for mechanisms of neural plasticity,2016,,,
10.3389/fphys.2021.732929,Liver Zonation – Revisiting Old Questions With New Technologies,2021,,,
10.1016/j.bbamcr.2021.119041,Interactions between reactive oxygen species and autophagy,2021,,,
10.1038/s41467-019-14115-z,A mosquito salivary protein promotes flavivirus transmission by activation of autophagy,2020,,,
10.1002/jcp.29819,Versatile role of curcumin and its derivatives in lung cancer therapy,2020,,,
10.1038/nmeth.f.301,Visualizing biological data—now and in the future,2010,,,
10.1523/jneurosci.4651-03.2004,Early Serotonergic Projections to Cajal-Retzius Cells: Relevance for Cortical Development,2004,,,
10.1073/pnas.1018985108,Dynamic reconfiguration of human brain networks during learning,2011,,,
10.1016/j.cub.2020.07.083,Circuit and Behavioral Mechanisms of Sexual Rejection by Drosophila Females,2020,,,
10.2478/intox-2014-0009,"Toxicity, mechanism and health effects of some heavy metals",2014,,,
10.1038/ncomms14908,A retinoraphe projection regulates serotonergic activity and looming-evoked defensive behaviour,2017,,,
10.3389/fncir.2018.00030,Reticulospinal Systems for Tuning Motor Commands,2018,,,
10.1016/j.neuron.2020.04.012,SEQUIN Multiscale Imaging of Mammalian Central Synapses Reveals Loss of Synaptic Connectivity Resulting from Diffuse Traumatic Brain Injury,2020,,,
10.1109/jiot.2014.2306328,Internet of Things for Smart Cities,2014,,,
10.1016/0092-8674(91)90418-x,A novel multigene family may encode odorant receptors: A molecular basis for odor recognition,1991,,,
10.1038/s41593-023-01281-z,Ascending neurons convey behavioral state to integrative sensory and action selection brain regions,2023,,,
10.1371/journal.pone.0087709,Distribution of VGLUT3 in Highly Collateralized Axons from the Rat Dorsal Raphe Nucleus as Revealed by Single-Neuron Reconstructions,2014,,,
10.3389/neuro.01.037.2008,Feature selectivity of the gamma-band of the local field potential in primate primary visual cortex,2008,,,
10.1038/s41467-020-17113-8,Neural circuits in the mouse retina support color vision in the upper visual field,2020,,,
10.1371/journal.pcbi.1003625,&lt;i&gt;In-Vivo&lt;/i&gt; Real-Time Control of Protein Expression from Endogenous and Synthetic Gene Networks,2014,,,
10.1073/pnas.2112672118,Kinematic self-replication in reconfigurable organisms,2021,,,
10.1093/eurheartj/ehy462,Fourth universal definition of myocardial infarction (2018),2018,,,
10.1523/jneurosci.0288-13.2013,Aberrant Restoration of Spines and their Synapses in L-DOPA-Induced Dyskinesia: Involvement of Corticostriatal but Not Thalamostriatal Synapses,2013,,,
10.1016/j.neuron.2014.08.013,Axon-Carrying Dendrites Convey Privileged Synaptic Input in Hippocampal Neurons,2014,,,
10.3389/fninf.2011.00013,"Nipype: A Flexible, Lightweight and Extensible Neuroimaging Data Processing Framework in Python",2011,,,
10.1523/jneurosci.4105-08.2009,Sensory Input Enhances Synaptogenesis of Adult-Born Neurons,2009,,,
10.1242/dev.116657,Striatal astrocytes produce neuroblasts in an excitotoxic model of Huntington's disease,2015,,,
10.1016/j.automatica.2013.01.048,Phase synchronization control of complex networks of Lagrangian systems on adaptive digraphs,2013,,,
10.1109/42.906426,Automated manifold surgery: constructing geometrically accurate and topologically correct models of the human cerebral cortex,2001,,,
10.1126/science.1132939,"The Connectivity Map: Using Gene-Expression Signatures to Connect Small Molecules, Genes, and Disease",2006,,,
10.1109/mcs.2016.2621465,Coalitional Control: Cooperative Game Theory and Control,2017,,,
10.1093/schbul/20.2.249,Dysmodularity: A Neurocognitive Model for Schizophrenia,1994,,,
10.1126/science.1553558,Generation of Neurons and Astrocytes from Isolated Cells of the Adult Mammalian Central Nervous System,1992,,,
10.1109/cvpr.2019.00768,Object Instance Annotation With Deep Extreme Level Set Evolution,2019,,,
10.1109/tpami.2018.2835450,Large Scale Image Segmentation with Structured Loss Based Deep Learning for Connectome Reconstruction,2018,,,
10.7554/elife.24838,Wiring variations that enable and constrain neural computation in a sensory microcircuit,2017,,,
10.1088/0031-9155/57/21/7117,Risk of radiogenic second cancers following volumetric modulated arc therapy and proton arc therapy for prostate cancer,2012,,,
10.1038/s42256-021-00376-1,Learning function from structure in neuromorphic networks,2021,,,
10.1146/annurev-anchem-091620-091314,Glycan Labeling and Analysis in Cells and In Vivo,2021,,,
10.3390/metabo10050179,The Role of Autophagy in White Adipose Tissue Function: Implications for Metabolic Health,2020,,,
10.1016/j.neuron.2020.12.016,Lowering Synaptogyrin-3 expression rescues Tau-induced memory defects and synaptic loss in the presence of microglial activation,2021,,,
10.1101/gad.345629.120,Autophagy in stromal fibroblasts promotes tumor desmoplasia and mammary tumorigenesis,2021,False,preprint,biorxiv
10.3389/fnmol.2017.00446,AMPA Receptor Trafficking in Natural and Pathological Aging,2018,,,
10.1007/s00109-020-01947-2,SCFAs induce autophagy in intestinal epithelial cells and relieve colitis by stabilizing HIF-1α,2020,,,
10.7554/elife.59976,Distinct subpopulations of mechanosensory chordotonal organ neurons elicit grooming of the fruit fly antennae,2020,,,
10.1038/ncomms13275,Myelinosome formation represents an early stage of oligodendrocyte damage in multiple sclerosis and its animal model,2016,,,
10.1109/wacv.2015.160,"How to Collect Segmentations for Biomedical Images? A Benchmark Evaluating the Performance of Experts, Crowdsourced Non-experts, and Algorithms",2015,,,
10.1002/cne.24353,The peripheral nervous system of the ascidian tadpole larva: Types of neurons and their synaptic networks,2017,,,
10.1017/s0140525x12000477,"Whatever next? Predictive brains, situated agents, and the future of cognitive science",2013,,,
10.1093/eurheartj/ehab395,2021 ESC/EACTS Guidelines for the management of valvular heart disease,2021,,,
10.1016/j.jshs.2019.10.001,Exercise-mediated regulation of autophagy in the cardiovascular system,2019,,,
10.1101/2024.02.07.579245,Anti-diuretic hormone ITP signals via a guanylate cyclase receptor to modulate systemic homeostasis in <i>Drosophila</i>,2024,False,preprint,biorxiv
10.1073/pnas.1301111110,From the physics of interacting polymers to optimizing routes on the London Underground,2013,,,
10.1109/tnnls.2012.2193414,Robust Synchronization for 2-D Discrete-Time Coupled Dynamical Networks,2012,,,
10.1109/tac.2020.3022532,Finite-Time Synchronization of Impulsive Dynamical Networks With Strong Nonlinearity,2020,,,
10.3390/ijms20205029,"Autophagy, Metabolism, and Alcohol-Related Liver Disease: Novel Modulators and Functions",2019,,,
10.1137/130947039,"Dynamic Control of Modern, Network-Based Epidemic Models",2015,,,
10.1242/dev.191411,Using <i>Drosophila</i> to drive the diagnosis and understand the mechanisms of rare human diseases,2020,,,
10.1038/nrn3783,Retinal bipolar cells: elementary building blocks of vision,2014,,,
10.1016/j.automatica.2018.02.014,Minimal controllability of conjunctive Boolean networks is NP-complete,2018,,,
10.1038/s41423-020-00630-3,"Necroptosis, pyroptosis and apoptosis: an intricate game of cell death",2021,,,
10.1016/j.jgr.2021.08.003,Syringaresinol derived from Panax ginseng berry attenuates oxidative stress-induced skin aging via autophagy,2021,,,
10.1007/978-3-319-06520-5_4,Preparing the Next Generation of Education Researchers for Big Data in Higher Education,2016,,,
10.1093/brain/awu132,The hubs of the human connectome are generally implicated in the anatomy of brain disorders,2014,,,
10.1089/brain.2011.0008,Functional and Effective Connectivity: A Review,2011,,,
10.1534/genetics.118.300682,Genetic Reagents for Making Split-GAL4 Lines in <i>Drosophila</i>,2018,,,
10.1109/icra48506.2021.9560937,Neuromorphic control for optic-flow-based landing of MAVs using the Loihi processor,2021,,,
10.1038/s41377-021-00590-x,Correlative optical photothermal infrared and X-ray fluorescence for chemical imaging of trace elements and relevant molecular structures directly in neurons,2021,,,
10.1074/jbc.ra119.009110,Deficiency of the autophagy gene ATG16L1 induces insulin resistance through KLHL9/KLHL13/CUL3-mediated IRS1 degradation,2019,,,
10.3390/biom12050672,Role of TFEB in Autophagy and the Pathogenesis of Liver Diseases,2022,,,
10.1016/j.neuron.2010.02.005,Functional-Anatomic Fractionation of the Brain's Default Network,2010,,,
10.1371/journal.pbio.3000174,Nystagmus in patients with congenital stationary night blindness (CSNB) originates from synchronously firing retinal ganglion cells,2019,,,
10.1371/journal.pbio.3001782,"The evolutionary conserved proteins CEP90, FOPNL, and OFD1 recruit centriolar distal appendage proteins to initiate their assembly",2022,,,
10.1038/s41598-022-13214-0,Dual-expression system for blue fluorescent protein optimization,2022,,,
10.1002/tox.23656,<scp>LncRNA RHPN1‐AS1</scp> inhibition induces autophagy and apoptosis in prostate cancer cells via the <scp>miR</scp>‐7‐5p/<scp>EGFR</scp>/<scp>PI3K</scp>/<scp>AKT</scp>/<scp>mTOR</scp> signaling pathway,2022,,,
10.1126/science.8209258,"Motor Neuron Degeneration in Mice that Express a Human Cu,Zn Superoxide Dismutase Mutation",1994,,,
10.1158/0008-5472.can-19-1555,Beclin 1 Promotes Endosome Recruitment of Hepatocyte Growth Factor Tyrosine Kinase Substrate to Suppress Tumor Proliferation,2019,,,
10.3390/cancers13143498,Autophagy Inhibition in BRAF-Driven Cancers,2021,,,
10.1007/s00221-018-5352-x,Rapid olfactory discrimination learning in adult zebrafish,2018,,,
10.1016/j.tics.2011.08.003,Large-scale brain networks and psychopathology: a unifying triple network model,2011,,,
10.1109/ojcs.2023.3267221,Backdoor Attacks to Deep Learning Models and Countermeasures: A Survey,2023,,,
10.3390/ijms22115891,Dexamethasone Downregulates Autophagy through Accelerated Turn-Over of the Ulk-1 Complex in a Trabecular Meshwork Cells Strain: Insights on Steroid-Induced Glaucoma Pathogenesis,2021,,,
10.1016/j.cell.2016.07.054,Comprehensive Classification of Retinal Bipolar Neurons by Single-Cell Transcriptomics,2016,,,
10.1002/dvdy.24169,Comprehensive morphological analysis of individual peripheral neuron dendritic arbors in ascidian larvae using the photoconvertible protein kaede,2014,,,
10.3402/jev.v4.27066,Biological properties of extracellular vesicles and their physiological functions,2015,,,
10.1002/cne.24251,Synaptogenesis and synaptic protein localization in the postnatal development of rod bipolar cell dendrites in mouse retina,2017,,,
10.1039/d3bm00598d,Matrix stiffness triggers chemoresistance through elevated autophagy in pancreatic ductal adenocarcinoma,2023,,,
10.1186/s40478-022-01370-3,"Changes in glial cell phenotypes precede overt neurofibrillary tangle formation, correlate with markers of cortical cell damage, and predict cognitive status of individuals at Braak III-IV stages",2022,,,
10.3390/biology9030059,Assessing Autophagy in Archived Tissue or How to Capture Autophagic Flux from a Tissue Snapshot,2020,,,
10.21037/atm-21-6579,The pannexin-1 channel regulates pyroptosis through autophagy in a mouse model of sepsis-associated encephalopathy,2021,,,
10.1016/j.jneumeth.2023.109898,Electrophysiological and morphological characterization of single neurons in intact human brain organoids,2023,,,
10.1016/j.drudis.2022.05.011,Targeting autophagy in colorectal cancer: An update on pharmacological small-molecule compounds,2022,,,
10.12688/wellcomeopenres.19666.2,A high-throughput 3D X-ray histology facility for biomedical research and preclinical applications,2023,,,
10.1016/j.neuron.2022.10.035,TEMPO enables sequential genetic labeling and manipulation of vertebrate cell lineages,2022,,,
10.32604/cmc.2021.017199,Cryptographic Based Secure Model on Dataset for Deep Learning Algorithms,2021,,,
10.1016/j.cub.2020.04.052,Animal Behavior: A Neural Basis of Individuality,2020,,,
10.1016/j.cub.2023.01.032,Neuronal excitability as a regulator of circuit remodeling,2023,,,
10.1038/s41598-021-87966-6,"ALK inhibition activates LC3B-independent, protective autophagy in EML4-ALK positive lung cancer cells",2021,,,
10.1007/s11307-010-0460-4,Chemical Imaging of Cardiac Cell and Tissue by Using Secondary Ion Mass Spectrometry,2010,,,
10.3390/mi10090599,The Applications of Lattice Light-Sheet Microscopy for Functional Volumetric Imaging of Hippocampal Neurons in a Three-Dimensional Culture System,2019,,,
10.15698/cst2021.10.257,Macroautophagy and normal aging of the nervous system: Lessons from animal models,2021,,,
10.1016/j.isci.2024.109106,Drosophila noktochor regulates night sleep via a local mushroom body circuit,2024,,,
10.1101/2025.04.07.647453,Bridging macroscopic and microscopic modeling of electric field by brain stimulation,2025,False,preprint,biorxiv
10.1007/978-3-031-16443-9_41,Weakly Supervised Volumetric Image Segmentation with Deformed Templates,2022,,,
10.1101/2025.04.02.645514,An intercellular metabolic relay for brain sparing in <i>Drosophila</i>,2025,False,preprint,biorxiv
10.64898/2026.03.04.709519,A minimal visual world model predicts exploration of naturalistic landscapes in flies,2026,,,
10.1038/d41586-024-03750-2,How a fly’s behavioural state affects its view of the world,2024,,,
10.1038/s41593-018-0109-1,A three-dimensional single-cell-resolution whole-brain atlas using CUBIC-X expansion microscopy and tissue clearing,2018,,,
10.1038/s41592-019-0403-1,Deep learning for cellular image analysis,2019,,,
10.1109/2.485891,Artificial neural networks: a tutorial,1996,,,
10.1080/146608200300079536,El Escorial revisited: Revised criteria for the diagnosis of amyotrophic lateral sclerosis,2000,,,
10.1016/j.neuron.2019.04.034,A Cellular-Resolution Atlas of the Larval Zebrafish Brain,2019,,,
10.1021/acsnano.0c03881,Nanoenabled Disruption of Multiple Barriers in Antigen Cross-Presentation of Dendritic Cells <i>via</i> Calcium Interference for Enhanced Chemo-Immunotherapy,2020,,,
10.1038/nrn3241,"The origin of extracellular fields and currents — EEG, ECoG, LFP and spikes",2012,,,
10.1016/j.celrep.2020.108138,Visual Input into the Drosophila melanogaster Mushroom Body,2020,,,
10.1093/brain/awr179,Sensitivity of revised diagnostic criteria for the behavioural variant of frontotemporal dementia,2011,,,
10.1002/anie.201405334,A Fast Deposition‐Crystallization Procedure for Highly Efficient Lead Iodide Perovskite Thin‐Film Solar Cells,2014,,,
10.1109/tmi.2021.3097826,Learning and Segmenting Dense Voxel Embeddings for 3D Neuron Reconstruction,2021,,,
10.1126/sciadv.aau3333,<i>Porphyromonas gingivalis</i> in Alzheimer’s disease brains: Evidence for disease causation and treatment with small-molecule inhibitors,2019,,,
,Deep Sparse Rectifier Neural Networks,2012,,,
10.1056/nejmoa1510665,Nivolumab versus Everolimus in Advanced Renal-Cell Carcinoma,2015,,,
10.1038/nrd4363,Overcoming the challenges in administering biopharmaceuticals: formulation and delivery strategies,2014,,,
10.1016/j.conb.2014.01.019,Toward large-scale connectome reconstructions,2014,,,
10.1073/pnas.1705623114,Superresolution expansion microscopy reveals the three-dimensional organization of the <i>Drosophila</i> synaptonemal complex,2017,,,
10.1038/nbt.1692,Programmable in situ amplification for multiplexed imaging of mRNA expression,2010,,,
10.2147/ndt.s1549,The relationship between early life stress and microstructural integrity of the corpus callosum in a non-clinical population,2008,,,
10.3389/fcell.2020.00428,Endoplasmic Reticulum–Mitochondria Contact Sites and Neurodegeneration,2020,,,
10.1007/s00454-002-2885-2,Topological Persistence and Simplification,2002,,,
10.1073/pnas.2118295119,Comparing human and chimpanzee temporal lobe neuroanatomy reveals modifications to human language hubs beyond the frontotemporal arcuate fasciculus,2022,,,
10.1039/c8cs00595h,Hydrogel bioelectronics,2018,,,
10.1021/acschembio.5b00289,Rational Polypharmacology: Systematically Identifying and Engaging Multiple Drug Targets To Promote Axon Growth,2015,,,
10.1016/j.apsusc.2004.03.101,Cluster primary ion bombardment of organic materials,2004,,,
10.1002/adma.201800561,30 Years of Lithium‐Ion Batteries,2018,,,
10.1038/s41577-020-0311-8,"The trinity of COVID-19: immunity, inflammation and intervention",2020,,,
10.1016/0166-2236(79)90074-2,Thalamic input to the cerebral cortex,1979,,,
10.1038/ncomms4586,Excitons versus free charges in organo-lead tri-halide perovskites,2014,,,
10.1126/science.273.5274.483,Crystalline Ropes of Metallic Carbon Nanotubes,1996,,,
10.1111/boc.201600024,Volume scanning electron microscopy for imaging biological ultrastructure,2016,,,
10.1038/s41562-020-0884-z,Using social and behavioural science to support COVID-19 pandemic response,2020,,,
10.1039/c5ee03874j,"Cesium-containing triple cation perovskite solar cells: improved stability, reproducibility and high efficiency",2016,,,
10.1038/nn.4290,Dense EM-based reconstruction of the interglomerular projectome in the zebrafish olfactory bulb,2016,,,
10.1016/j.jasms.2005.06.005,Improvement of biological time-of-flight-secondary ion mass spectrometry imaging with a bismuth cluster ion source,2005,,,
10.1101/2020.10.24.353409,A meta-learning approach to (re)discover plasticity rules that carve a desired function into a neural network,2020,False,preprint,biorxiv
10.1016/j.neuroimage.2020.117091,Functional reorganization of brain networks across the human menstrual cycle,2020,,,
10.1016/j.yexcr.2023.113600,Berberine attenuates liver fibrosis by autophagy inhibition triggering apoptosis via the miR-30a-5p/ATG5 axis,2023,,,
10.1038/ncomms9414,Controllability of structural brain networks,2015,,,
10.1088/1367-2630/9/1/002,"Sedimentation of particles acted upon by a vertical, time-oscillating force",2007,,,
10.1038/nature07127,The quantum internet,2008,,,
10.7554/elife.26975.037,Author response: A connectome of a learning and memory center in the adult Drosophila brain,2017,,,
10.1007/s10120-011-0042-4,Japanese gastric cancer treatment guidelines 2010 (ver. 3),2011,,,
10.1093/cercor/bhr291,Parcellations and Hemispheric Asymmetries of Human Cerebral Cortex Analyzed on Surface-Based Atlases,2011,,,
10.1111/j.1365-246x.2007.03414.x,Ambient noise Rayleigh wave tomography of New Zealand,2007,,,
10.1093/genetics/iyad064,"Visual processing in the fly, from photoreceptors to behavior",2023,,,
10.1371/journal.pcbi.1000381,Functional Brain Networks Develop from a “Local to Distributed” Organization,2009,,,
10.1109/iccv.2011.6126240,Segmentation fusion for connectomics,2011,,,
10.1242/dev.160879,A targeted 3D EM and correlative microscopy method using SEM array tomography,2018,,,
10.1038/nature22391,Layer-dependent ferromagnetism in a van der Waals crystal down to the monolayer limit,2017,,,
10.1002/cne.22184,Synaptic organization in the adult <i>Drosophila</i> mushroom body calyx,2009,,,
10.1136/jnnp.2007.131045,Parkinson's disease: clinical features and diagnosis,2008,,,
